{
  "$schema": "https://json-schema.org/draft/2020-12/schema",
  "$id": "https://raw.githubusercontent.com/ailib-official/ai-protocol/main/schemas/v2/provider.json",
  "title": "AI Protocol V2 Provider Manifest",
  "description": "Complete provider manifest schema for AI-Protocol V2. Supports the three-ring concentric circle model: Ring 1 (Core Skeleton), Ring 2 (Capability Mapping), Ring 3 (Advanced Extensions).",
  "type": "object",
  "required": [
    "id",
    "protocol_version",
    "endpoint",
    "error_classification",
    "capabilities"
  ],
  "properties": {
    "$schema": {
      "type": "string",
      "description": "Schema reference URL"
    },
    "id": {
      "type": "string",
      "pattern": "^[a-z0-9][a-z0-9-_]{1,63}$",
      "description": "Stable provider identifier (lowercase, alphanumeric, hyphens, underscores)"
    },
    "protocol_version": {
      "type": "string",
      "description": "AI-Protocol version this manifest conforms to"
    },
    "name": {
      "type": "string",
      "description": "Human-readable provider name"
    },
    "version": {
      "type": "string",
      "description": "Provider API version"
    },
    "status": {
      "type": "string",
      "enum": ["stable", "beta", "deprecated"],
      "default": "stable",
      "description": "Provider status"
    },
    "category": {
      "type": "string",
      "enum": ["ai_provider", "model_provider", "third_party_aggregator"],
      "description": "Provider category"
    },
    "official_url": {
      "type": "string",
      "format": "uri",
      "description": "Official documentation website"
    },
    "support_contact": {
      "type": "string",
      "format": "uri",
      "description": "Support or feedback link"
    },
    "endpoint": {
      "$ref": "./endpoint.json"
    },
    "availability": {
      "$ref": "./availability.json"
    },
    "capabilities": {
      "$ref": "./capabilities.json"
    },
    "error_classification": {
      "type": "object",
      "description": "Error classification mappings for this provider",
      "properties": {
        "by_http_status": {
          "type": "object",
          "additionalProperties": { "type": "string" }
        },
        "by_error_code": {
          "type": "object",
          "additionalProperties": { "type": "string" }
        },
        "retry_after_extraction": {
          "type": "object",
          "description": "Optional pattern to extract Retry-After from error response body when header is absent",
          "properties": {
            "pattern": { "type": "string", "description": "Regex with capture group for numeric value" },
            "unit": { "type": "string", "enum": ["seconds", "milliseconds"], "default": "seconds" }
          }
        },
        "notes": {
          "type": "array",
          "items": { "type": "string" }
        }
      }
    },
    "parameters": {
      "type": "object",
      "description": "Standard parameter definitions for this provider",
      "additionalProperties": true
    },
    "streaming": {
      "type": "object",
      "description": "Streaming configuration (decoder, event_map, accumulator, candidate)",
      "additionalProperties": true
    },
    "api_families": {
      "oneOf": [
        { "type": "array", "items": { "type": "string" } },
        { "type": "object", "additionalProperties": true }
      ],
      "description": "API family declarations"
    },
    "default_api_family": {
      "type": "string",
      "description": "Default API family to use"
    },
    "endpoints": {
      "type": "object",
      "description": "Named endpoint definitions",
      "additionalProperties": true
    },
    "services": {
      "type": "object",
      "description": "Service endpoint definitions (list_models, etc.)",
      "additionalProperties": true
    },
    "rate_limit_headers": {
      "type": "object",
      "description": "Rate limit header mappings",
      "additionalProperties": true
    },
    "retry_policy": {
      "type": "object",
      "description": "Retry policy configuration",
      "properties": {
        "strategy": {
          "type": "string",
          "enum": ["exponential_backoff", "linear_backoff", "fixed_delay"]
        },
        "max_retries": { "type": "integer", "minimum": 0 },
        "min_delay_ms": { "type": "integer", "minimum": 0 },
        "max_delay_ms": { "type": "integer", "minimum": 0 },
        "jitter": { "type": "string", "enum": ["full", "equal", "none"] },
        "retry_on_http_status": {
          "type": "array",
          "items": { "type": "integer" }
        }
      }
    },
    "termination": {
      "type": "object",
      "description": "Termination reason normalization",
      "properties": {
        "source_field": { "type": "string" },
        "mapping": {
          "type": "object",
          "additionalProperties": { "type": "string" }
        }
      }
    },
    "guardrails": {
      "type": "object",
      "description": "Input/output guardrail configuration",
      "additionalProperties": true
    },
    "features": {
      "type": "object",
      "description": "Protocol-level feature flags",
      "additionalProperties": { "type": "boolean" }
    },
    "multimodal": {
      "$ref": "./multimodal.json",
      "description": "Extended multimodal capability configuration (Ring 2)"
    },
    "computer_use": {
      "$ref": "./computer-use.json",
      "description": "Computer Use / GUI automation configuration (Ring 2)"
    },
    "mcp": {
      "$ref": "./mcp.json",
      "description": "Model Context Protocol integration configuration (Ring 2)"
    },
    "context_policy": {
      "$ref": "./context-policy.json",
      "description": "Context window management policy configuration (Ring 3)"
    },
    "provider_contract": {
      "$ref": "./provider-contract.json",
      "description": "Runtime provider driver contract specification (Ring 3)"
    },
    "capability_profile": {
      "$ref": "./capability-profile.json",
      "description": "Experimental I/O/P/S/C capability profile metadata (design-stage, optional)"
    },
    "metadata": {
      "type": "object",
      "description": "Additional provider-specific metadata",
      "properties": {
        "models": {
          "type": "object",
          "description": "Model-level capacity and operational metadata keyed by model id",
          "additionalProperties": {
            "$ref": "./metadata-model-entry.json"
          }
        }
      },
      "additionalProperties": true
    },
    "pricing": {
      "$ref": "./pricing.json",
      "description": "Optional pricing for cost estimation (per 1k tokens)"
    },
    "tool_calling": {
      "$ref": "./tool-calling.json",
      "description": "Native function calling and text fallback configuration (optional)"
    }
  },
  "additionalProperties": false
}

