{
  "$schema": "https://raw.githubusercontent.com/ailib-official/ai-protocol/main/schemas/v2/provider.json",
  "id": "groq",
  "protocol_version": "2.0",
  "name": "Groq",
  "version": "1.0.0",
  "status": "stable",
  "category": "ai_provider",
  "official_url": "https://console.groq.com/docs",
  "support_contact": "https://support.groq.com",
  "endpoint": {
    "base_url": "https://api.groq.com/openai/v1",
    "chat": "/chat/completions",
    "auth": {
      "type": "bearer",
      "header": "Authorization",
      "prefix": "Bearer",
      "token_env": "GROQ_API_KEY"
    }
  },
  "error_classification": {
    "by_http_status": {
      "400": "invalid_request",
      "401": "authentication",
      "403": "permission_denied",
      "404": "not_found",
      "429": "rate_limited",
      "500": "server_error",
      "503": "overloaded"
    },
    "by_error_code": {
      "context_length_exceeded": "request_too_large",
      "model_not_found": "not_found",
      "rate_limit_exceeded": "rate_limited"
    }
  },
  "availability": {
    "required": false,
    "regions": [
      "global"
    ],
    "check": {
      "method": "GET",
      "path": "/models",
      "expected_status": [
        200,
        401
      ],
      "timeout_ms": 3000
    }
  },
  "capabilities": {
    "required": [
      "text",
      "streaming",
      "tools"
    ],
    "optional": [
      "parallel_tools",
      "agentic"
    ],
    "feature_flags": {
      "parallel_tool_calls": true,
      "streaming_usage": true,
      "system_messages": true
    },
    "tool_calling": {
      "native": {
        "supported": true,
        "reliability": "full",
        "parallel": true,
        "notes": "PT-079 audit: backend-model dependent; no text_fallback until live proves dialect"
      },
      "text_fallback": null
    }
  },
  "parameters": {
    "temperature": {
      "type": "float",
      "range": [
        0,
        2
      ],
      "default": 1
    },
    "max_tokens": {
      "type": "integer",
      "min": 1,
      "max": 8192
    },
    "top_p": {
      "type": "float",
      "range": [
        0,
        1
      ]
    },
    "stream": {
      "type": "boolean"
    }
  },
  "streaming": {
    "decoder": {
      "format": "sse",
      "strategy": "openai_chat",
      "done_signal": "[DONE]",
      "prefix": "data: "
    },
    "content_path": "$.choices[0].delta.content",
    "tool_call_path": "$.choices[0].delta.tool_calls",
    "usage_path": "$.usage",
    "event_map": [
      {
        "match": "exists($.choices[*].delta.content)",
        "emit": "PartialContentDelta",
        "fields": {
          "content": "$.choices[*].delta.content"
        }
      },
      {
        "match": "exists($.choices[*].delta.tool_calls)",
        "emit": "PartialToolCall",
        "fields": {
          "tool_calls": "$.choices[*].delta.tool_calls"
        }
      },
      {
        "match": "exists($.usage)",
        "emit": "Metadata",
        "fields": {
          "usage": "$.usage"
        }
      },
      {
        "match": "$.choices[*].finish_reason != null",
        "emit": "StreamEnd",
        "fields": {
          "finish_reason": "$.choices[*].finish_reason"
        }
      }
    ],
    "stop_condition": "$.choices[0].finish_reason != null"
  },
  "multimodal": {
    "input": {
      "vision": {
        "supported": false
      },
      "audio": {
        "supported": false
      },
      "video": {
        "supported": false
      }
    },
    "output": {
      "text": true,
      "audio": {
        "supported": false
      },
      "image": {
        "supported": false
      }
    }
  },
  "api_families": [
    "chat_completions"
  ],
  "default_api_family": "chat_completions",
  "endpoints": {
    "chat": {
      "path": "/chat/completions",
      "method": "POST",
      "adapter": "openai"
    }
  },
  "services": {
    "list_models": {
      "path": "/models",
      "method": "GET",
      "response_binding": "data"
    }
  },
  "retry_policy": {
    "strategy": "exponential_backoff",
    "max_retries": 3,
    "min_delay_ms": 1000,
    "max_delay_ms": 30000,
    "jitter": "full",
    "retry_on_http_status": [
      429,
      500,
      502,
      503
    ]
  },
  "termination": {
    "source_field": "finish_reason",
    "mapping": {
      "stop": "end_turn",
      "length": "max_tokens",
      "tool_calls": "tool_use"
    }
  },
  "metadata": {
    "api_compatibility": "openai",
    "models": {
      "llama-3.1-8b-instant": {
        "context_window": 128000,
        "max_output_tokens": 8192,
        "verification": {
          "status": "verified",
          "source": "api_probe",
          "verified_at": "2026-08-16",
          "notes": "PT-FRESH: present on GET /openai/v1/models"
        },
        "model_capabilities": {
          "tool_call": true,
          "reasoning": false,
          "attachment": false
        },
        "modalities": {
          "input": [
            "text"
          ],
          "output": [
            "text"
          ]
        },
        "family": "llama-3.1"
      },
      "llama-3.3-70b-versatile": {
        "context_window": 131072,
        "max_output_tokens": 32768,
        "family": "llama-3.3",
        "pricing": {
          "input_per_1m": 0.59,
          "output_per_1m": 0.79
        },
        "model_capabilities": {
          "tool_call": true,
          "reasoning": false,
          "attachment": false
        },
        "modalities": {
          "input": [
            "text"
          ],
          "output": [
            "text"
          ]
        },
        "verification": {
          "status": "verified",
          "source": "api_probe",
          "verified_at": "2026-08-16",
          "notes": "PT-FRESH: present on GET /openai/v1/models"
        }
      },
      "openai/gpt-oss-120b": {
        "context_window": 131072,
        "max_output_tokens": 65536,
        "status": "active",
        "family": "gpt-oss",
        "open_weights": true,
        "model_capabilities": {
          "tool_call": true,
          "structured_output": true,
          "reasoning": true,
          "attachment": false
        },
        "modalities": {
          "input": [
            "text"
          ],
          "output": [
            "text"
          ]
        },
        "pricing": {
          "input_per_1m": 0.15,
          "output_per_1m": 0.6
        },
        "verification": {
          "status": "verified",
          "source": "api_probe",
          "verified_at": "2026-08-16",
          "notes": "PT-FRESH: present on GET /openai/v1/models"
        }
      },
      "qwen/qwen3.6-27b": {
        "context_window": 131072,
        "max_output_tokens": 40960,
        "status": "active",
        "family": "qwen3",
        "open_weights": true,
        "model_capabilities": {
          "tool_call": true,
          "reasoning": true,
          "attachment": false
        },
        "modalities": {
          "input": [
            "text"
          ],
          "output": [
            "text"
          ]
        },
        "pricing": {
          "input_per_1m": 0.6,
          "output_per_1m": 3
        },
        "verification": {
          "status": "verified",
          "source": "api_probe",
          "verified_at": "2026-08-16",
          "notes": "PT-FRESH: present on GET /openai/v1/models; successor for retired qwen/qwen3-32b"
        }
      }
    },
    "deprecated": {
      "meta-llama/llama-4-scout-17b-16e-instruct": {
        "retired_on": "2026-07-17",
        "maps_to": "qwen/qwen3.6-27b",
        "note": "Absent from live GET /openai/v1/models on 2026-08-16 (PT-FRESH verify)"
      },
      "qwen/qwen3-32b": {
        "retired_on": "2026-07-17",
        "maps_to": "qwen/qwen3.6-27b",
        "note": "Absent from live GET /openai/v1/models on 2026-08-16; prior docs shutdown 2026-07-17"
      }
    },
    "sdk": {
      "note": "OpenAI-compatible — use openai SDK with base_url override",
      "python": "openai",
      "typescript": "openai"
    }
  }
}