{
  "$schema": "https://raw.githubusercontent.com/ailib-official/ai-protocol/main/schemas/v2/provider.json",
  "id": "nvidia",
  "protocol_version": "2.0",
  "name": "NVIDIA NIM",
  "version": "1.0.0",
  "status": "stable",
  "category": "third_party_aggregator",
  "official_url": "https://build.nvidia.com/explore/discover",
  "support_contact": "https://docs.api.nvidia.com/nim/docs",
  "endpoint": {
    "base_url": "https://integrate.api.nvidia.com/v1",
    "chat": "/chat/completions",
    "auth": {
      "type": "bearer",
      "header": "Authorization",
      "prefix": "Bearer",
      "token_env": "NVIDIA_API_KEY"
    }
  },
  "error_classification": {
    "by_http_status": {
      "400": "invalid_request",
      "401": "authentication",
      "403": "permission_denied",
      "404": "not_found",
      "429": "rate_limited",
      "500": "server_error",
      "503": "overloaded"
    },
    "by_error_code": {
      "context_length_exceeded": "request_too_large",
      "model_not_found": "not_found",
      "rate_limit_exceeded": "rate_limited"
    }
  },
  "availability": {
    "required": false,
    "regions": [
      "global"
    ],
    "check": {
      "method": "GET",
      "path": "/models",
      "expected_status": [
        200,
        401
      ],
      "timeout_ms": 5000
    }
  },
  "capabilities": {
    "required": [
      "text",
      "streaming",
      "tools"
    ],
    "optional": [
      "vision",
      "parallel_tools",
      "agentic",
      "reasoning"
    ],
    "feature_flags": {
      "parallel_tool_calls": true,
      "streaming_usage": true,
      "system_messages": true
    }
  },
  "parameters": {
    "temperature": {
      "type": "float",
      "range": [
        0,
        2
      ],
      "default": 1
    },
    "max_tokens": {
      "type": "integer",
      "min": 1,
      "max": 8192
    },
    "top_p": {
      "type": "float",
      "range": [
        0,
        1
      ]
    },
    "stream": {
      "type": "boolean"
    }
  },
  "streaming": {
    "decoder": {
      "format": "sse",
      "strategy": "openai_chat",
      "done_signal": "[DONE]",
      "prefix": "data: "
    },
    "content_path": "$.choices[0].delta.content",
    "tool_call_path": "$.choices[0].delta.tool_calls",
    "usage_path": "$.usage",
    "event_map": [
      {
        "match": "exists($.choices[*].delta.content)",
        "emit": "PartialContentDelta",
        "fields": {
          "content": "$.choices[*].delta.content"
        }
      },
      {
        "match": "exists($.choices[*].delta.tool_calls)",
        "emit": "PartialToolCall",
        "fields": {
          "tool_calls": "$.choices[*].delta.tool_calls"
        }
      },
      {
        "match": "exists($.usage)",
        "emit": "Metadata",
        "fields": {
          "usage": "$.usage"
        }
      },
      {
        "match": "$.choices[*].finish_reason != null",
        "emit": "StreamEnd",
        "fields": {
          "finish_reason": "$.choices[*].finish_reason"
        }
      }
    ],
    "stop_condition": "$.choices[0].finish_reason != null"
  },
  "multimodal": {
    "input": {
      "vision": {
        "supported": true,
        "formats": [
          "jpeg",
          "png",
          "gif",
          "webp"
        ],
        "encoding_methods": [
          "base64_inline",
          "url"
        ]
      },
      "audio": {
        "supported": false
      },
      "video": {
        "supported": false
      }
    },
    "output": {
      "text": true,
      "audio": {
        "supported": false
      },
      "image": {
        "supported": false
      }
    }
  },
  "api_families": [
    "chat_completions"
  ],
  "default_api_family": "chat_completions",
  "endpoints": {
    "chat": {
      "path": "/chat/completions",
      "method": "POST",
      "adapter": "openai"
    }
  },
  "services": {
    "list_models": {
      "path": "/models",
      "method": "GET",
      "response_binding": "data"
    }
  },
  "retry_policy": {
    "strategy": "exponential_backoff",
    "max_retries": 3,
    "min_delay_ms": 1000,
    "max_delay_ms": 30000,
    "jitter": "full",
    "retry_on_http_status": [
      429,
      500,
      502,
      503
    ]
  },
  "termination": {
    "source_field": "finish_reason",
    "mapping": {
      "stop": "end_turn",
      "length": "max_tokens",
      "tool_calls": "tool_use"
    }
  },
  "metadata": {
    "api_compatibility": "openai",
    "models": {
      "nvidia/llama-3.3-nemotron-super-49b-v1": {
        "context_window": 128000,
        "max_output_tokens": 8192,
        "verification": {
          "status": "operational",
          "source": "eos",
          "notes": "HK deployment verified chat model (hiddenpath/eos main@299575a)"
        }
      },
      "meta/llama-3.1-8b-instruct": {
        "context_window": 128000,
        "max_output_tokens": 8192,
        "verification": {
          "status": "operational",
          "source": "eos"
        }
      },
      "moonshotai/kimi-k2-instruct": {
        "context_window": 128000,
        "max_output_tokens": 8192,
        "verification": {
          "status": "operational",
          "source": "velaclaw-trial",
          "notes": "NVIDIA API catalog — OpenAI-compatible chat"
        }
      }
    },
    "sdk": {
      "note": "OpenAI-compatible — use openai SDK with base_url override",
      "python": "openai",
      "typescript": "openai"
    }
  }
}