{
  "$schema": "https://raw.githubusercontent.com/ailib-official/ai-protocol/main/schemas/v2/provider.json",
  "id": "baichuan",
  "protocol_version": "2.0",
  "name": "百川智能 (Baichuan)",
  "version": "1.0.0",
  "status": "stable",
  "category": "ai_provider",
  "official_url": "https://platform.baichuan-ai.com/docs/api",
  "support_contact": "https://www.baichuan-ai.com/contact",
  "endpoint": {
    "base_url": "https://api.baichuan-ai.com/v1",
    "chat": "/chat/completions",
    "auth": {
      "type": "bearer",
      "header": "Authorization",
      "prefix": "Bearer",
      "token_env": "BAICHUAN_API_KEY"
    }
  },
  "error_classification": {
    "by_http_status": {
      "400": "invalid_request",
      "401": "authentication",
      "403": "permission_denied",
      "404": "not_found",
      "429": "rate_limited",
      "500": "server_error",
      "503": "overloaded"
    },
    "by_error_code": {
      "context_length_exceeded": "request_too_large",
      "model_not_found": "not_found",
      "rate_limit_exceeded": "rate_limited"
    }
  },
  "availability": {
    "required": false,
    "regions": [
      "cn"
    ],
    "check": {
      "method": "GET",
      "path": "/models",
      "expected_status": [
        200,
        401
      ],
      "timeout_ms": 3000
    }
  },
  "capabilities": {
    "required": [
      "text",
      "streaming",
      "tools"
    ],
    "optional": [
      "agentic",
      "structured_output"
    ],
    "feature_flags": {
      "streaming_usage": true,
      "system_messages": true,
      "structured_output": true
    },
    "tool_calling": {
      "native": {
        "supported": true,
        "reliability": "full",
        "parallel": false,
        "streaming": true,
        "notes": "OpenAI-compatible tool_calls; arguments are JSON strings"
      },
      "text_fallback": null
    }
  },
  "parameters": {
    "temperature": {
      "type": "float",
      "range": [
        0,
        2
      ],
      "default": 1
    },
    "max_tokens": {
      "type": "integer",
      "min": 1,
      "max": 131072
    },
    "top_p": {
      "type": "float",
      "range": [
        0,
        1
      ]
    },
    "top_k": {
      "type": "integer",
      "min": 1,
      "max": 100
    },
    "stream": {
      "type": "boolean"
    },
    "stop": {
      "type": "string"
    }
  },
  "streaming": {
    "decoder": {
      "format": "sse",
      "strategy": "openai_chat",
      "done_signal": "[DONE]",
      "prefix": "data: "
    },
    "content_path": "$.choices[0].delta.content",
    "tool_call_path": "$.choices[0].delta.tool_calls",
    "usage_path": "$.usage",
    "event_map": [
      {
        "match": "exists($.choices[*].delta.content)",
        "emit": "PartialContentDelta",
        "fields": {
          "content": "$.choices[*].delta.content"
        }
      },
      {
        "match": "exists($.choices[*].delta.tool_calls)",
        "emit": "PartialToolCall",
        "fields": {
          "tool_calls": "$.choices[*].delta.tool_calls"
        }
      },
      {
        "match": "exists($.usage)",
        "emit": "Metadata",
        "fields": {
          "usage": "$.usage"
        }
      },
      {
        "match": "$.choices[*].finish_reason != null",
        "emit": "StreamEnd",
        "fields": {
          "finish_reason": "$.choices[*].finish_reason"
        }
      }
    ],
    "stop_condition": "$.choices[0].finish_reason != null"
  },
  "multimodal": {
    "input": {
      "vision": {
        "supported": false
      },
      "audio": {
        "supported": false
      },
      "video": {
        "supported": false
      }
    },
    "output": {
      "text": true,
      "audio": {
        "supported": false
      },
      "image": {
        "supported": false
      }
    }
  },
  "api_families": [
    "chat_completions"
  ],
  "default_api_family": "chat_completions",
  "endpoints": {
    "chat": {
      "path": "/chat/completions",
      "method": "POST",
      "adapter": "openai"
    }
  },
  "services": {
    "list_models": {
      "path": "/models",
      "method": "GET",
      "response_binding": "data"
    }
  },
  "retry_policy": {
    "strategy": "exponential_backoff",
    "max_retries": 3,
    "min_delay_ms": 1000,
    "max_delay_ms": 30000,
    "jitter": "full",
    "retry_on_http_status": [
      429,
      500,
      502,
      503
    ]
  },
  "termination": {
    "source_field": "finish_reason",
    "mapping": {
      "stop": "end_turn",
      "length": "max_tokens",
      "tool_calls": "tool_use",
      "content_filter": "refusal"
    }
  },
  "metadata": {
    "api_compatibility": "openai",
    "models": {
      "Baichuan4": {
        "context_window": 128000,
        "max_output_tokens": 8192,
        "status": "active",
        "family": "baichuan-4",
        "model_capabilities": {
          "tool_call": true,
          "structured_output": true,
          "reasoning": false,
          "attachment": false
        },
        "modalities": {
          "input": [
            "text"
          ],
          "output": [
            "text"
          ]
        },
        "verification": {
          "status": "verified",
          "source": "official_documentation",
          "verified_at": "2026-07-24"
        }
      },
      "Baichuan3-Turbo": {
        "context_window": 32768,
        "max_output_tokens": 8192,
        "status": "active",
        "family": "baichuan-3",
        "model_capabilities": {
          "tool_call": true,
          "structured_output": true,
          "reasoning": false,
          "attachment": false
        },
        "modalities": {
          "input": [
            "text"
          ],
          "output": [
            "text"
          ]
        },
        "verification": {
          "status": "verified",
          "source": "official_documentation",
          "verified_at": "2026-07-24"
        }
      },
      "Baichuan3-Turbo-128k": {
        "context_window": 131072,
        "max_output_tokens": 8192,
        "status": "active",
        "family": "baichuan-3",
        "model_capabilities": {
          "tool_call": true,
          "structured_output": true,
          "reasoning": false,
          "attachment": false
        },
        "modalities": {
          "input": [
            "text"
          ],
          "output": [
            "text"
          ]
        },
        "verification": {
          "status": "verified",
          "source": "official_documentation",
          "verified_at": "2026-07-24"
        }
      }
    },
    "sdk": {
      "note": "OpenAI-compatible — use openai SDK with base_url https://api.baichuan-ai.com/v1",
      "python": "openai",
      "typescript": "openai"
    }
  }
}